{
  "$schema": "https://json-schema.org/draft/2020-12/schema",
  "$id": "https://d2p.nonnast.dev/schemas/measurement/fit-evaluation-report.schema.json",
  "title": "D2P Fit Evaluation Report",
  "description": "Derived document: the fit evaluation of one pattern evaluation against pinned fit-profile and garment-measurement-spec revisions. It is evidence, never an authoritative artifact, and it never claims a guaranteed fit. It distinguishes analytical results, simulation results and real fitting observations.",
  "$comment": "Schema catalog section 3.3 (design decision ADR-011 sections 2 and 7). resultDigest per digest profile d2p-digest-v1, excluding contentDigest, resultDigest, reportId and createdAt. Array order: inputDigests per catalog section 1.8, results by id, diagnostics per catalog section 1.8. Mandatory inputDigests roles (pattern, fit-profile, garment-measurement-spec) and evaluationRef.digest are required by this schema.",
  "type": "object",
  "additionalProperties": false,
  "required": [
    "documentType",
    "schemaVersion",
    "reportId",
    "createdAt",
    "evaluationRef",
    "evaluator",
    "inputDigests",
    "evidenceKind",
    "results",
    "containsPersonalData",
    "diagnostics",
    "resultDigest"
  ],
  "properties": {
    "documentType": {
      "description": "Document type discriminator.",
      "type": "string",
      "const": "d2p:fit-evaluation-report"
    },
    "schemaVersion": {
      "description": "Full SemVer of the standard release this document was written against.",
      "$ref": "https://d2p.nonnast.dev/schemas/core/ids.schema.json#/$defs/schemaVersion"
    },
    "reportId": {
      "description": "Own ID of the report (prefix 'fer_').",
      "$ref": "https://d2p.nonnast.dev/schemas/core/ids.schema.json#/$defs/fitEvaluationReportId"
    },
    "createdAt": {
      "description": "UTC time the report was produced. Excluded from resultDigest.",
      "$ref": "https://d2p.nonnast.dev/schemas/core/ids.schema.json#/$defs/timestamp"
    },
    "evaluationRef": {
      "description": "Reference to the pattern-evaluation document this report evaluates. digest is required and holds that evaluation's resultDigest.",
      "type": "object",
      "$ref": "https://d2p.nonnast.dev/schemas/core/artifact-ref.schema.json#/$defs/derivedRef",
      "properties": {
        "digest": true
      },
      "required": [
        "digest"
      ]
    },
    "evaluator": {
      "description": "The evaluator that produced the report (engine, versions, evaluator profile, optional precision).",
      "$ref": "https://d2p.nonnast.dev/schemas/core/ids.schema.json#/$defs/evaluatorDescriptor"
    },
    "inputDigests": {
      "description": "Digests of all pinned inputs. Roles 'pattern', 'fit-profile' and 'garment-measurement-spec' are mandatory.",
      "type": "array",
      "minItems": 1,
      "items": {
        "$ref": "https://d2p.nonnast.dev/schemas/core/digest.schema.json#/$defs/inputDigest"
      },
      "allOf": [
        {
          "contains": {
            "type": "object",
            "properties": {
              "role": {
                "type": "string",
                "const": "pattern"
              }
            },
            "required": [
              "role"
            ]
          }
        },
        {
          "contains": {
            "type": "object",
            "properties": {
              "role": {
                "type": "string",
                "const": "fit-profile"
              }
            },
            "required": [
              "role"
            ]
          }
        },
        {
          "contains": {
            "type": "object",
            "properties": {
              "role": {
                "type": "string",
                "const": "garment-measurement-spec"
              }
            },
            "required": [
              "role"
            ]
          }
        }
      ]
    },
    "evidenceKind": {
      "description": "Kind of evidence: 'analytical' (computed from evaluated geometry), 'simulation' (3D simulation), 'fitting-observation' (a real fitting). Kinds are never mixed in one report.",
      "type": "string",
      "enum": [
        "analytical",
        "simulation",
        "fitting-observation"
      ]
    },
    "results": {
      "description": "One result per evaluated garment measurement, sorted by id.",
      "type": "array",
      "items": {
        "$ref": "#/$defs/fitResult"
      }
    },
    "containsPersonalData": {
      "description": "True if the report contains values derived from an artifact classified 'personal' or 'sensitive-personal' (e.g. a body measurement profile of an individual).",
      "type": "boolean"
    },
    "diagnostics": {
      "description": "Diagnostics raised while evaluating fit (may be empty, then written as []). Messages and details MUST NOT contain raw personal measurement values.",
      "type": "array",
      "items": {
        "$ref": "https://d2p.nonnast.dev/schemas/core/diagnostic.schema.json#/$defs/diagnostic"
      }
    },
    "resultDigest": {
      "description": "Digest of the report per digest profile d2p-digest-v1, excluding contentDigest, resultDigest, reportId and createdAt.",
      "$ref": "https://d2p.nonnast.dev/schemas/core/digest.schema.json#/$defs/digest"
    },
    "contentDigest": {
      "description": "Optional digest of this document per digest profile d2p-digest-v1 (excluding contentDigest itself).",
      "$ref": "https://d2p.nonnast.dev/schemas/core/digest.schema.json#/$defs/digest"
    },
    "extensions": {
      "description": "Optional namespaced extension blocks.",
      "$ref": "https://d2p.nonnast.dev/schemas/core/extension.schema.json#/$defs/extensions"
    }
  },
  "$defs": {
    "fitResult": {
      "title": "Fit result",
      "description": "Predicted value of one garment measurement, compared with its target where one applies.",
      "type": "object",
      "additionalProperties": false,
      "required": [
        "id",
        "garmentDefinitionId",
        "predicted",
        "status"
      ],
      "properties": {
        "id": {
          "description": "Element ID of the result, unique within the report.",
          "$ref": "https://d2p.nonnast.dev/schemas/core/ids.schema.json#/$defs/elementId"
        },
        "garmentDefinitionId": {
          "description": "Garment measurement definition of the result (informative, not resolved by the referential level).",
          "$ref": "https://d2p.nonnast.dev/schemas/core/ids.schema.json#/$defs/qualifiedName"
        },
        "predicted": {
          "description": "Predicted (or, for fitting observations, observed) value of the garment measurement.",
          "$ref": "https://d2p.nonnast.dev/schemas/core/units.schema.json#/$defs/quantity"
        },
        "target": {
          "description": "Target value the prediction is compared with. Absent when no target applies.",
          "$ref": "https://d2p.nonnast.dev/schemas/core/units.schema.json#/$defs/quantity"
        },
        "deviation": {
          "description": "predicted − target. Absent when no target applies.",
          "$ref": "https://d2p.nonnast.dev/schemas/core/units.schema.json#/$defs/quantity"
        },
        "status": {
          "description": "'within-tolerance', 'outside-tolerance', or 'not-evaluated' (no target, tolerance or evidence available). Never a fit guarantee.",
          "type": "string",
          "enum": [
            "within-tolerance",
            "outside-tolerance",
            "not-evaluated"
          ]
        },
        "extensions": {
          "description": "Optional namespaced extension blocks.",
          "$ref": "https://d2p.nonnast.dev/schemas/core/extension.schema.json#/$defs/extensions"
        }
      }
    }
  }
}
