{
  "documentType": "d2p:fit-evaluation-report",
  "schemaVersion": "1.0.0",
  "reportId": "fer_golden-tshirt-r1-size-a-relaxed-knit",
  "createdAt": "2026-01-02T00:00:00Z",
  "evaluationRef": {
    "id": "pev_golden-tshirt-r1-size-a-relaxed-knit",
    "digest": "sha256:a93d73ca65157695e8f3cb0781e6e4bb92112d83086d69d7d0e3b45636231f15"
  },
  "evaluator": {
    "engineId": "golden-fixture",
    "engineVersion": "1.0.0",
    "algorithmProfileVersion": "1.0.0",
    "evaluatorProfile": {
      "id": "d2p:golden-fixture-analytic",
      "version": "1.0.0"
    }
  },
  "inputDigests": [
    {
      "role": "fit-profile",
      "artifactRef": {
        "artifactId": "art_golden-tshirt-fit-profile-relaxed",
        "revisionId": "rev_golden-tshirt-fit-profile-relaxed-r1"
      },
      "digest": "sha256:c169d05f39839cc47fc48793b564318056ac26ae2328f13ecba0516a174bec2e"
    },
    {
      "role": "garment-measurement-spec",
      "artifactRef": {
        "artifactId": "art_golden-tshirt-garment-measurement-spec",
        "revisionId": "rev_golden-tshirt-garment-measurement-spec-r1"
      },
      "digest": "sha256:82fdc914a640b0cef99e956f20bf931e1f6328dee5828813dc4fa8aa7dadb219"
    },
    {
      "role": "grading-rule-set",
      "artifactRef": {
        "artifactId": "art_golden-tshirt-grading-rule-set",
        "revisionId": "rev_golden-tshirt-grading-rule-set-r1"
      },
      "digest": "sha256:5754eca2347369aefca12b2414dd69659081b88c058b4db2f2923e513189e9d8"
    },
    {
      "role": "material-assumptions",
      "digest": "sha256:cecb9d3583aae7b73d8505de408efc47a10d45319676a1062380df8028759954"
    },
    {
      "role": "measurement-definition-registry",
      "id": {
        "id": "d2p:measurement-definitions",
        "version": "1.0.0"
      },
      "digest": "sha256:c4026449780808e4fa4b9d1f3b0ed8d02e1b63fc7ee6512193b302e7ea4eb4fd"
    },
    {
      "role": "pattern",
      "artifactRef": {
        "artifactId": "art_golden-tshirt-pattern",
        "revisionId": "rev_golden-tshirt-pattern-r1"
      },
      "digest": "sha256:ef7edb92161d6db884d89db7b16baac1e1432e26e9d9ff1f1a1ce23649eb6949"
    },
    {
      "role": "size-system",
      "artifactRef": {
        "artifactId": "art_golden-tshirt-size-system",
        "revisionId": "rev_golden-tshirt-size-system-r1"
      },
      "digest": "sha256:57d8493744de25f3eec5792e75cbc89b1fb0f11223ad9b8ffde542027a5d94cc"
    },
    {
      "role": "tolerance-profile",
      "id": {
        "id": "d2p:golden-tshirt-2d",
        "version": "1.0.0"
      },
      "digest": "sha256:0f0a4b144bf0c71acda4b07a65b72355aa1e4c078a0598c181c9869565a7fd8d"
    },
    {
      "role": "validation-profile",
      "id": {
        "id": "d2p:sample-cut",
        "version": "1.0.0"
      },
      "digest": "sha256:abddc6507c20c4ce8d28e6ba4582ab409d9966055ab16c3739993264dc313e51"
    }
  ],
  "evidenceKind": "analytical",
  "results": [
    {
      "id": "target-chest-girth-size-a-relaxed-knit",
      "garmentDefinitionId": "d2p:garment.chest-girth",
      "predicted": {
        "value": 1020,
        "unit": "mm"
      },
      "target": {
        "value": 1080,
        "unit": "mm"
      },
      "deviation": {
        "value": -60,
        "unit": "mm"
      },
      "status": "outside-tolerance"
    },
    {
      "id": "target-sleeve-length-size-a-relaxed-knit",
      "garmentDefinitionId": "d2p:garment.sleeve-length",
      "predicted": {
        "value": 197.991012623,
        "unit": "mm"
      },
      "target": {
        "value": 198,
        "unit": "mm"
      },
      "deviation": {
        "value": -0.008987377,
        "unit": "mm"
      },
      "status": "within-tolerance"
    }
  ],
  "containsPersonalData": false,
  "diagnostics": [],
  "resultDigest": "sha256:2db204aef9837fae1116068adb70c05facb80826bfcfeefd19fb40df5aff0a5c"
}
